{
  "event_id": "evt-1720000123000000003",
  "event_type": "reconnect.cleared",
  "emitted_at": "2026-07-13T07:54:32Z",
  "truth_kind": "runtime",
  "subject": {
    "kind": "peer",
    "id": "ed25519:reconnect-peer"
  },
  "details": {
    "protocol": "/quip/control/1",
    "class": "interactive",
    "state": "backing_off",
    "attempt_count": 2,
    "reason": "operator cleared reconnect state"
  }
}
